{
  "$schema": "./schemas/name-that-book.schema.json",
  "game": "name-that-book",
  "version": 1,
  "displayName": "Name That Book",
  "roundsPerSession": 10,
  "sessions": [
    {
      "id": "ntb-session-01",
      "title": "Name That Book Pack 1",
      "theme": "Bible book clues",
      "rounds": [
        {
          "id": "ntb-r01",
          "book": "Genesis",
          "testament": "Old Testament",
          "category": "Law",
          "aliases": [
            "Genesis",
            "Gen"
          ],
          "clues": [
            "This book belongs to the Law section.",
            "It is in the Old Testament.",
            "It opens the Bible and is followed by Exodus.",
            "It focuses on creation, the patriarchs, and Joseph.",
            "Its title is Genesis."
          ],
          "difficulty": "easy",
          "teachingNote": "Review Genesis and how it connects to the Bible before continuing."
        },
        {
          "id": "ntb-r02",
          "book": "Exodus",
          "testament": "Old Testament",
          "category": "Law",
          "aliases": [
            "Exodus",
            "Exod"
          ],
          "clues": [
            "This book belongs to the Law section.",
            "It is in the Old Testament.",
            "It is placed after Genesis and before Leviticus in the Protestant Bible order.",
            "It focuses on Israel's rescue from Egypt and the covenant at Sinai.",
            "Its title is Exodus."
          ],
          "difficulty": "medium",
          "teachingNote": "Review Exodus and how it connects to the Bible before continuing."
        },
        {
          "id": "ntb-r03",
          "book": "Leviticus",
          "testament": "Old Testament",
          "category": "Law",
          "aliases": [
            "Leviticus",
            "Lev"
          ],
          "clues": [
            "This book belongs to the Law section.",
            "It is in the Old Testament.",
            "It is placed after Exodus and before Numbers in the Protestant Bible order.",
            "It focuses on priests, sacrifices, holiness, and worship.",
            "Its title is Leviticus."
          ],
          "difficulty": "hard",
          "teachingNote": "Review Leviticus and how it connects to the Bible before continuing."
        },
        {
          "id": "ntb-r04",
          "book": "Numbers",
          "testament": "Old Testament",
          "category": "Law",
          "aliases": [
            "Numbers",
            "Num"
          ],
          "clues": [
            "This book belongs to the Law section.",
            "It is in the Old Testament.",
            "It is placed after Leviticus and before Deuteronomy in the Protestant Bible order.",
            "It focuses on wilderness travel, censuses, rebellion, and preparation.",
            "Its title is Numbers."
          ],
          "difficulty": "easy",
          "teachingNote": "Review Numbers and how it connects to the Bible before continuing."
        },
        {
          "id": "ntb-r05",
          "book": "Deuteronomy",
          "testament": "Old Testament",
          "category": "Law",
          "aliases": [
            "Deuteronomy",
            "Deut"
          ],
          "clues": [
            "This book belongs to the Law section.",
            "It is in the Old Testament.",
            "It is placed after Numbers and before Joshua in the Protestant Bible order.",
            "It focuses on Moses renewing the covenant before Canaan.",
            "Its title is Deuteronomy."
          ],
          "difficulty": "medium",
          "teachingNote": "Review Deuteronomy and how it connects to the Bible before continuing."
        },
        {
          "id": "ntb-r06",
          "book": "Joshua",
          "testament": "Old Testament",
          "category": "History",
          "aliases": [
            "Joshua",
            "Josh"
          ],
          "clues": [
            "This book belongs to the History section.",
            "It is in the Old Testament.",
            "It is placed after Deuteronomy and before Judges in the Protestant Bible order.",
            "It focuses on entering and dividing the promised land.",
            "Its title is Joshua."
          ],
          "difficulty": "hard",
          "teachingNote": "Review Joshua and how it connects to the Bible before continuing."
        },
        {
          "id": "ntb-r07",
          "book": "Judges",
          "testament": "Old Testament",
          "category": "History",
          "aliases": [
            "Judges",
            "Judg"
          ],
          "clues": [
            "This book belongs to the History section.",
            "It is in the Old Testament.",
            "It is placed after Joshua and before Ruth in the Protestant Bible order.",
            "It focuses on Israel's cycles of sin, oppression, and rescue.",
            "Its title is Judges."
          ],
          "difficulty": "easy",
          "teachingNote": "Review Judges and how it connects to the Bible before continuing."
        },
        {
          "id": "ntb-r08",
          "book": "Ruth",
          "testament": "Old Testament",
          "category": "History",
          "aliases": [
            "Ruth"
          ],
          "clues": [
            "This book belongs to the History section.",
            "It is in the Old Testament.",
            "It is placed after Judges and before 1 Samuel in the Protestant Bible order.",
            "It focuses on loyalty, Boaz, and David's family line.",
            "Its title is Ruth."
          ],
          "difficulty": "medium",
          "teachingNote": "Review Ruth and how it connects to the Bible before continuing."
        },
        {
          "id": "ntb-r09",
          "book": "1 Samuel",
          "testament": "Old Testament",
          "category": "History",
          "aliases": [
            "1 Samuel",
            "First Samuel",
            "1 Sam"
          ],
          "clues": [
            "This book belongs to the History section.",
            "It is in the Old Testament.",
            "It is placed after Ruth and before 2 Samuel in the Protestant Bible order.",
            "It focuses on Samuel, Saul, and David's rise.",
            "Its title is 1 Samuel."
          ],
          "difficulty": "hard",
          "teachingNote": "Review 1 Samuel and how it connects to the Bible before continuing."
        },
        {
          "id": "ntb-r10",
          "book": "2 Samuel",
          "testament": "Old Testament",
          "category": "History",
          "aliases": [
            "2 Samuel",
            "Second Samuel",
            "2 Sam"
          ],
          "clues": [
            "This book belongs to the History section.",
            "It is in the Old Testament.",
            "It is placed after 1 Samuel and before 1 Kings in the Protestant Bible order.",
            "It focuses on David's reign over Israel.",
            "Its title is 2 Samuel."
          ],
          "difficulty": "easy",
          "teachingNote": "Review 2 Samuel and how it connects to the Bible before continuing."
        }
      ]
    },
    {
      "id": "ntb-session-02",
      "title": "Name That Book Pack 2",
      "theme": "Bible book clues",
      "rounds": [
        {
          "id": "ntb-r11",
          "book": "1 Kings",
          "testament": "Old Testament",
          "category": "History",
          "aliases": [
            "1 Kings",
            "First Kings",
            "1 Kgs"
          ],
          "clues": [
            "This book belongs to the History section.",
            "It is in the Old Testament.",
            "It is placed after 2 Samuel and before 2 Kings in the Protestant Bible order.",
            "It focuses on Solomon, the divided kingdom, and Elijah.",
            "Its title is 1 Kings."
          ],
          "difficulty": "medium",
          "teachingNote": "Review 1 Kings and how it connects to the Bible before continuing."
        },
        {
          "id": "ntb-r12",
          "book": "2 Kings",
          "testament": "Old Testament",
          "category": "History",
          "aliases": [
            "2 Kings",
            "Second Kings",
            "2 Kgs"
          ],
          "clues": [
            "This book belongs to the History section.",
            "It is in the Old Testament.",
            "It is placed after 1 Kings and before 1 Chronicles in the Protestant Bible order.",
            "It focuses on the decline and exile of Israel and Judah.",
            "Its title is 2 Kings."
          ],
          "difficulty": "hard",
          "teachingNote": "Review 2 Kings and how it connects to the Bible before continuing."
        },
        {
          "id": "ntb-r13",
          "book": "1 Chronicles",
          "testament": "Old Testament",
          "category": "History",
          "aliases": [
            "1 Chronicles",
            "First Chronicles",
            "1 Chr"
          ],
          "clues": [
            "This book belongs to the History section.",
            "It is in the Old Testament.",
            "It is placed after 2 Kings and before 2 Chronicles in the Protestant Bible order.",
            "It focuses on genealogies and David's kingdom.",
            "Its title is 1 Chronicles."
          ],
          "difficulty": "easy",
          "teachingNote": "Review 1 Chronicles and how it connects to the Bible before continuing."
        },
        {
          "id": "ntb-r14",
          "book": "2 Chronicles",
          "testament": "Old Testament",
          "category": "History",
          "aliases": [
            "2 Chronicles",
            "Second Chronicles",
            "2 Chr"
          ],
          "clues": [
            "This book belongs to the History section.",
            "It is in the Old Testament.",
            "It is placed after 1 Chronicles and before Ezra in the Protestant Bible order.",